{
    "event_name": "shipmentProductsAllocated",
    "event_timestamp": "2026-04-04T12:30:00Z",
    "event_id": "e2",
    "event_data": {
        "shipment_id": "s2",
        "shipment_business_id": "sh_2",
        "shipment_type": "wholesale",
        "products": [
            {
                "product_id": "p3",
                "product_quantity": 8
            },
            {
                "product_id": "p4",
                "product_quantity": 12
            }
        ]
    }
}
